feedspotPage,feedspotFeedId,feedspotFolderId,name,rssUrl,websiteUrl,notes,tier,category,dinner_score,enabled,error
"https://www.feedspot.com/reader/fo/7957209/fe/5421296","5421296","7957209","Astro Crane Blog","https://www.astrocrane.com/blog.html/feed/","//astrocrane.com","Astro Crane offers Lifting Equipment and Hydraulic Cranes in Vermont. Astro Crane began in 1980 as Astro Welding and Fabricating, an industrial welding and steel fabrication enterprise boasting a single crane for equipment. Astro Crane is Massachusett's most trusted hydraulic crane rental company. If you have any questions about a Crane please call us today at (978) 429-8666. Astro Crane is Massachusett's most trusted hydraulic crane rental company.","","","10","true",""
"https://www.feedspot.com/reader/fo/7957209/fe/5421291","5421291","7957209","Concord Cranes Blog","https://concordcranes.com/feed/","//concordcranes.com","Trusted, well-established brands like Castle Crane Hire, Elcon Crane Hire, Anglo V3 Crane Hire, Concord Crane Hire Namibia, Material Handling Logistics, and Rent-A-Plant, who have collectively been around for over a decade, have united to form our powerful and rejuvenated company, the Concord Cranes Group. With our leadership stemming right from the roots, our business operations represent experience and wisdom.","","","10","true",""
"https://www.feedspot.com/reader/fo/7957209/fe/5680819","5680819","7957209","Crane and Hoist Canada","https://www.craneandhoistcanada.com/feed/","//craneandhoistcanada.com","Crane and Hoist Canada is a publication that provides news, features, products, events, and information related to the crane and hoist industry in Canada. They cover topics such as business operations, cranes, deliveries, education and training, lifting equipment, markets and reports, ports, projects and infrastructure, safety and risk management, sustainability, technology, and the workforce.","","","10","true",""
"https://www.feedspot.com/reader/fo/7957209/fe/5421355","5421355","7957209","Crane Tech Services Blog","https://craneservices.ca/blog/feed/","//craneservices.ca","Crane Tech Services has been inspecting equipment for companies in the Barrie, Orillia, and Simcoe County area for over 15 years now. We inspect and certify many types of equipment from Overhead Cranes to Truck Mounted Loaders and Cranes to Aerial Lifting Devices we make sure that your operators are safe and that your company is up to date on safety. We use the most up-to-date techniques in Non-Destructive Testing Equipment.","","","10","true",""
"https://www.feedspot.com/reader/fo/7957209/fe/5680820","5680820","7957209","Cranes & Lifting","https://www.cranesandlifting.com.au/feed","//cranesandlifting.com.au","Prime Creative Media is a multi-platform publishing and events business engaged with high-growth industries. It is Australia's largest business-to-business publisher, specializing in multi-platform communications. The magazines, websites, and events help connect, inform, and grow the commercial road transportation, mining and manufacturing, food & beverage, and education sectors.","","","10","true",""
"https://www.feedspot.com/reader/fo/7957209/fe/5421256","5421256","7957209","Eagle West Crane & Rigging News","https://www.eaglewestcranes.com/news/feed/","//eaglewestcranes.com","Eagle West Crane & Rigging blog. Stay up to date with the latest company news and information by checking out our blog. Eagle West Cranes has been serving British Columbia with complete lifting services for over 23 years. Our priority is to provide customer focused, safe, and reliable lifting solutions.","","","10","true",""
"https://www.feedspot.com/reader/fo/7957209/fe/5421527","5421527","7957209","Emerson Cranes Blog","https://emersoncranes.com/category/blog/feed/","//emersoncranes.com","Emerson is the leading crane hire company in London and the South of the UK. As trusted lifting professionals, we have the right people and products to support your projects safely and efficiently. With health and safety practices leading the way in an industry where safety is of the utmost importance Emerson Crane Hire has become a trusted name, recognized by our clients who require expert lifting specialists to plan and carry out all of their lifting requirements, be that crane hire or contract lift.","","","10","true",""
"https://www.feedspot.com/reader/fo/7957209/fe/5601546","5601546","7957209","Factory & Handling Solutions Magazine » Materials Handling","https://factoryandhandlingsolutions.co.uk/category/materials-handling/feed/","//factoryandhandlingsolutions.co.uk","Factory & Handling Solutions is the principal publication in its field, presenting the latest product developments supported by in-depth articles and comment from key players in manufacturing and engineering. Get the latest news in material handling, insights and more!","","","10","true",""
"https://www.feedspot.com/reader/fo/7957209/fe/5601547","5601547","7957209","Handling Network Magazine","https://www.handling-network.com/feed/","//handling-network.com","Handling Network is a comprehensive magazine covering materials handling, storage, and distribution in Ireland. Serving as a crucial marketing tool for the industry, it reaches over 3000 key personnel in top Irish companies, in addition to its subscription database.","","","10","true",""
"https://www.feedspot.com/reader/fo/7957209/fe/5421518","5421518","7957209","Hi-Speed Industrial Service Blog","https://www.gohispeed.com/feed/","//gohispeed.com","Hello, my name is Ben Buffington, the owner of Hi-Speed Industrial Service. We're an independent Industrial repair company that services both cranes and motors. Our mission is always to keep our customers up and running. In this blog, we inform and educate readers and potential customers about the essentials and advanced aspects of our services.","","","10","true",""
"https://www.feedspot.com/reader/fo/7957209/fe/5421276","5421276","7957209","Krishna Crane Engineers Blog","https://www.hoistsandcrane.com/blog/feed/","//hoistsandcrane.com","Read the latest blogs and articles on crane & hoist, about product details. We are one of the leading manufacturers of crane and hoist equipment due to our well-experienced professionals who specialize in crane and hoist manufacturing. Electric wire rope hoist, EOT crane, jib crane, single girder EOT crane, double girder EOT crane, flameproof wire rope hoist, gantry crane, manual hoist, goods lift/ cage lift, electric winch, crane accessories, and more, based in Ahmedabad India since 2005.","","","10","true",""
"https://www.feedspot.com/reader/fo/7957209/fe/5601542","5601542","7957209","Material Handling Wholesaler Magazine","https://www.mhwmag.com/feed/","//mhwmag.com","Our mission is to provide our readers with the finest and up-to-date industry news, supplier and parts contacts using our exclusive Source Directory and business-related services. Material Handling Wholesaler is published by Specialty Publications International, Inc. MHW has served the industry for over 40 years.","","","10","true",""
"https://www.feedspot.com/reader/fo/7957209/fe/5421633","5421633","7957209","MHI","http://s354933259.onlinehome.us/mhi-blog/feed/","//materialhandlingsafety.org","MHI is the nation's largest material handling, logistics, and supply chain association. MHI offers education, networking, and solution sourcing for members, their customers, and the industry as a whole through programming and events.","","","10","true",""
"https://www.feedspot.com/reader/fo/7957209/fe/5421275","5421275","7957209","MIT Hoist & Crane Blog","https://www.mithoist.com/blog/feed/","//mithoist.com","MIT Hoists & Chains have been in the business of material handling equipment and machinery for a period of time now. We design one of the best appropriate specifications for the machinery along with different custom design requirements.
From hoist chains to trolleys and different crane components you will get everything you need at our store in supreme quality. We have a lot of clients widespread along over the world who have been in business with us for years.","","","10","true",""
"https://www.feedspot.com/reader/fo/7957209/fe/5421277","5421277","7957209","O'Brien Lifting Solutions Inc.Blog","https://obrienliftingsolutions.com/feed/","//obrienliftingsolutions.com","O'Brien lifting solutions is the industry's leading manufacturer & supplier of industrial cranes, lifting equipment & doors. Contact for workstation crane, jib crane, monorail crane, wire rope and chain hoist, and commercial doors. Trust our experts, get a quote today. We design, manufacture, install and even take down your existing cranes. The total package is available to you.","","","10","true",""
"https://www.feedspot.com/reader/fo/7957209/fe/5421278","5421278","7957209","Premier Cranes & Rigging Blog","https://www.premiercranes.com.au/blog/feed","//premiercranes.com.au","At Premier Cranes & Rigging, we pride ourselves on providing personalized service and finding the best lifting solution for our clients. Our record of providing an exceptional standard of service, alongside competitive crane hire rates has helped us to build solid customer relationships. All of our cranes are routinely serviced to meet CICA-certified industry standards and safety regulations.","","","10","true",""
"https://www.feedspot.com/reader/fo/7957209/fe/5421526","5421526","7957209","Rebco Crane & Rigging Service Blog","https://rebcocraneandrigging.com/feed","//rebcocraneandrigging.com","REBCO Crane and Rigging is a full-service crane rental business that offers all types of residential and commercial lifting and rigging with our fleet of cranes and operators. While maintaining a strong local presence in Southern California for the past 3 decades. We service all types of general hoisting needs for commercial and residential with cranes up to 70 tons in most of Southern California. The counties we service are Riverside, Los Angeles, San Bernardino, and Orange, and have just opened a location in Washington County Utah in the city of St. George.","","","10","true",""
"https://www.feedspot.com/reader/fo/7957209/fe/5421517","5421517","7957209","TNT Crane & Rigging News","https://www.tntcrane.ca/news/feed/","//tntcrane.ca","TNT Crane & Rigging Blog check out our blog for the latest news, updates, tips, and resources. Since the company was first founded in Houston, Texas in 1985 with a single 18-ton crane, TNT Crane & Rigging has maintained the same simple philosophy of providing customers with exceptional service, quality equipment, trained personnel, and a fair price. Over the 30+ years that we have been in business, our company has continued to grow, adding more branches and state-of-the-art equipment like mobile cranes with lifting capacities up to 1300 tons, and crawler cranes.","","","10","true",""
"https://www.feedspot.com/reader/fo/7957209/fe/5287501","5287501","7957209","Workplace Material Handling & Safety","https://www.workplacepub.com/feed/","//workplacepub.com","Workplace Material Handling & Safety is a reference tool for buyers and sellers of new, used and surplus equipment, materials, services and supplies. We connect facilities & operations with EHS to help solve the challenge of productivity and safety.","","","10","true",""
"https://www.feedspot.com/reader/fo/7957209/fe/5422496","5422496","7957209","Al Waha Cranes Blog","https://www.alwahacranes.com/feed/","//alwahacranes.com","Subscribe to Al Waha Crane (Official Street Crane Supplier in Dubai, UAE) Blog for the latest articles and industry news. Al Waha cranes is an Exclusive supplier of STREET Crane, known as one of the most innovative, progressive reputed suppliers of bespoke material. Al Waha cranes is one of the most innovative, progressive reputed supplier of bespoke material handling solutions viz. EOT Crane, Overhead cranes, Gantry cranes, Jib Cranes, Monorail hoists, and free-standing superstructures in DUBAI, UAE, INDIA, and other MENA countries.","","","10","true",""
"https://www.feedspot.com/reader/fo/7957209/fe/5421533","5421533","7957209","Barnhart Crane Blog","https://www.barnhartcrane.com/blog/feed","//barnhartcrane.com","Barnhart is North America's leading provider of innovative solutions to complex lifting and transportation challenges faced by heavy industry. Barnhart was founded in 1969 in Memphis, Tennessee, as a small, family-owned business. While we are still a family-run company, Barnhart has grown to be one of the largest heavy lift and heavy transport organizations in the United States with more than 50 locations across the country and a nationwide reputation for solving problems.","","","10","true",""
"https://www.feedspot.com/reader/fo/7957209/fe/5422468","5422468","7957209","BOB Cranes Blog","https://www.bobcranes.com/blogs/feed/","//bobcranes.com","We go beyond our boundaries to explore endless possibilities in heavy lifting. Bob heavy equipment rental LLC is one of the prestigious crane rental companies in UAE. with our customer-focused approach and a continuous quest for world-class quality, we have unmatched expertise across technology, equipment, safety, and an acclaimed authority in all our major lifting projects.","","","10","true",""
"https://www.feedspot.com/reader/fo/7957209/fe/5601543","5601543","7957209","eureka","https://eurekapub.eu/feed","//eurekapub.eu","The online magazine for materials handling professionals. eureka magazine is published three times a year and distributed to key people involved in the buying or specifying of materials handling equipment and services.","","","10","true",""
"https://www.feedspot.com/reader/fo/7957209/fe/5422495","5422495","7957209","Ganesh Engineering Co Blog","https://www.ganeshcrane.com/blogs/feed/","//ganeshcrane.com","Read our new updates on the EOT crane, Single Grider EOT Crane, Double Grider Overhead Crane, and many other updates! Stay tuned with Ganesh Engineering Company and get the updates. We are a leading manufacturer and supplier of Materials Handling Equipment such as Single Girder / Double Girder EOT cranes, Wire Rope Hoists, Jib Cranes, Goliath/Gantry Cranes, Wire Rope Winches, Monorail Hoists, underslung Cranes, Goods Lifts, and Industrial sheds, etc. since 2004. We are manufacturing our equipment strictly as per IS CODE 807, 800,3177, 4137.","","","10","true",""
"https://www.feedspot.com/reader/fo/7957209/fe/5421283","5421283","7957209","GGR Group Blog","https://www.ggrgroup.com/blog/feed/","//ggrgroup.com","GGR Group is Europe's leading supplier of complete lifting solutions, boasting the largest fleet of lifting equipment for sale or hire. Established in 1995, the family-run business employs over 140 people in the UK and 30 dealers across Europe and the United Arab Emirates. The company was founded by Graeme and Gill Riley, who turned it into a dynamic international group, with innovation and first to market approach at the forefront of everything that the company embark on.","","","10","true",""
"https://www.feedspot.com/reader/fo/7957209/fe/5419109","5419109","7957209","International Industrial Vehicle Technology » Material Handling","https://www.ivtinternational.com/news/materials-handling/feed","//ivtinternational.com","Looking for Materials Handling news? From mobile hydraulics, ergonomics, engine technology, and vehicle design at Industrial Vehicle Technology International we've got it covered. Bringing you the latest developments in off-highway and industrial vehicle technology globally.","","","10","true",""
"https://www.feedspot.com/reader/fo/7957209/fe/5421521","5421521","7957209","Shupper-Brickle » Hoist Guy's Blog","https://www.sbomh.com/blogs/hoist-guys-blog.atom","//sbomh.com","This category is about Crane hoists, Bridge Crane Engineering, Bridge Cranes, kits, engineering, and more. Find innovative solutions to all your overhead lifting and crane questions with the Hoist Guy's Blog, providing helpful information, purchasing, and safety tips from real case studies. Since 1969, Shopper-Brickle Equipment Company has provided overhead material handling equipment, replacement parts, and comprehensive services to customers in the Mid-Atlantic States.","","","10","true",""
"https://www.feedspot.com/reader/fo/7957209/fe/5421281","5421281","7957209","St George Cranes Blog","https://stgeorgecranes.com.au/blog/feed/","//stgeorgecranes.com.au","Read and learn about interesting crane information and tips on how to operate a crane safely. Check out our blog for more information. St George Cranes has more than 25 years of experience working in the rigging and crane hire industries in Sydney and the metro region. Located in the heart of Mortdale, St George Cranes is the local crane hire service that Sydneysiders rely on.","","","10","true",""
"https://www.feedspot.com/reader/fo/7957209/fe/5421295","5421295","7957209","Topgun Cranes Blog","https://topguncranes.com.au/feed/","//topguncranes.com.au","Topgun cranes offer you over two decades of valuable industry experience. We provide solutions to all your civil, construction and crane hire needs. Welcome to top gun cranes, your ideal provider when it comes to mobile crane hire in Australia. Our skilled staff & technicians specialize across all areas of central Sydney and outlying regions boasting more than fifty years of combined industry experience. For more information about operating a crane truck, truck lift, safety factors in operating a crane truck and mobile crane hiring tips read our blogs.","","","10","true",""